match,market_name,home_team,home_win,away_team,away_win,margin,agency
Carolina Hurricanes v Montreal Canadiens,Head To Head,Carolina Hurricanes,1.3,Montreal Canadiens,3.56,1.05,Sportsbet
Florida Panthers v Utah Hockey Club,Head To Head,Florida Panthers,1.43,Utah Hockey Club,2.83,1.053,Sportsbet
Columbus Blue Jackets v Vancouver Canucks,Head To Head,Columbus Blue Jackets,1.81,Vancouver Canucks,2,1.052,Sportsbet
Winnipeg Jets v New Jersey Devils,Head To Head,Winnipeg Jets,1.55,New Jersey Devils,2.47,1.05,Sportsbet
Chicago Blackhawks v Vegas Golden Knights,Head To Head,Chicago Blackhawks,3.63,Vegas Golden Knights,1.29,1.051,Sportsbet
Anaheim Ducks v New York Rangers,Head To Head,Anaheim Ducks,2.37,New York Rangers,1.59,1.051,Sportsbet
