match,market_name,home_team,home_win,away_team,away_win,margin,agency
Dallas Stars v Tampa Bay Lightning,Head To Head,Dallas Stars,1.85,Tampa Bay Lightning,1.87,1.075,Sportsbet
Chicago Blackhawks v Los Angeles Kings,Head To Head,Chicago Blackhawks,6.75,Los Angeles Kings,1.08,1.074,Sportsbet
Edmonton Oilers v Winnipeg Jets,Head To Head,Edmonton Oilers,2.03,Winnipeg Jets,1.73,1.071,Sportsbet
Utah Hockey Club v Buffalo Sabres,Head To Head,Utah Hockey Club,1.18,Buffalo Sabres,4.5,1.07,Sportsbet
Vegas Golden Knights v Boston Bruins,Head To Head,Vegas Golden Knights,1.35,Boston Bruins,3,1.074,Sportsbet
San Jose Sharks v Carolina Hurricanes,Head To Head,San Jose Sharks,3.6,Carolina Hurricanes,1.26,1.071,Sportsbet
Pittsburgh Penguins v Columbus Blue Jackets,Head To Head,Pittsburgh Penguins,1.74,Columbus Blue Jackets,2.1,1.051,Sportsbet
