match,market_name,home_team,home_win,away_team,away_win,margin,agency
Colorado Avalanche v Vegas Golden Knights,Head To Head,Colorado Avalanche,1.68,Vegas Golden Knights,2.1,1.071,Sportsbet
Tampa Bay Lightning v Toronto Maple Leafs,Head To Head,Tampa Bay Lightning,1.58,Toronto Maple Leafs,2.39,1.051,Sportsbet
New York Rangers v Philadelphia Flyers,Head To Head,New York Rangers,1.52,Philadelphia Flyers,2.55,1.05,Sportsbet
Minnesota Wild v San Jose Sharks,Head To Head,Minnesota Wild,1.32,San Jose Sharks,3.4,1.052,Sportsbet
Edmonton Oilers v St. Louis Blues,Head To Head,Edmonton Oilers,1.78,St. Louis Blues,2.04,1.052,Sportsbet
Anaheim Ducks v Calgary Flames,Head To Head,Anaheim Ducks,2.18,Calgary Flames,1.69,1.05,Sportsbet
