match,market_name,home_team,home_win,away_team,away_win,margin,agency
Florida Panthers v Pittsburgh Penguins,Head To Head,Florida Panthers,1.75,Pittsburgh Penguins,2,1.071,Sportsbet
St. Louis Blues (-2.5) v Nashville Predators (+2.5),Head To Head,St. Louis Blues (-2.5),2.35,Nashville Predators (+2.5),1.55,1.071,Sportsbet
Vegas Golden Knights v Tampa Bay Lightning,Head To Head,Vegas Golden Knights,1.14,Tampa Bay Lightning,5.2,1.07,Sportsbet
Anaheim Ducks v Carolina Hurricanes,Head To Head,Anaheim Ducks,2.65,Carolina Hurricanes,1.44,1.072,Sportsbet
Los Angeles Kings v Boston Bruins,Head To Head,Los Angeles Kings,1.35,Boston Bruins,3.21,1.052,Sportsbet
New Jersey Devils v Vancouver Canucks,Head To Head,New Jersey Devils,1.58,Vancouver Canucks,2.39,1.051,Sportsbet
New York Islanders v Columbus Blue Jackets,Head To Head,New York Islanders,1.68,Columbus Blue Jackets,2.19,1.052,Sportsbet
Dallas Stars v Minnesota Wild,Head To Head,Dallas Stars,1.42,Minnesota Wild,2.92,1.047,Sportsbet
Utah Hockey Club v Detroit Red Wings,Head To Head,Utah Hockey Club,1.61,Detroit Red Wings,2.33,1.05,Sportsbet
