match,market_name,home_team,home_win,away_team,away_win,margin,agency
Carolina Hurricanes v Boston Bruins,Head To Head,Carolina Hurricanes,1.34,Boston Bruins,3.27,1.052,Sportsbet
Tampa Bay Lightning v Buffalo Sabres,Head To Head,Tampa Bay Lightning,1.43,Buffalo Sabres,2.86,1.049,Sportsbet
Detroit Red Wings v Utah Hockey Club,Head To Head,Detroit Red Wings,1.96,Utah Hockey Club,1.85,1.051,Sportsbet
Philadelphia Flyers v Winnipeg Jets,Head To Head,Philadelphia Flyers,2.28,Winnipeg Jets,1.63,1.052,Sportsbet
Florida Panthers v Columbus Blue Jackets,Head To Head,Florida Panthers,1.39,Columbus Blue Jackets,3,1.053,Sportsbet
Dallas Stars v Calgary Flames,Head To Head,Dallas Stars,1.4,Calgary Flames,2.98,1.05,Sportsbet
Nashville Predators v Seattle Kraken,Head To Head,Nashville Predators,1.71,Seattle Kraken,2.15,1.05,Sportsbet
Edmonton Oilers v Montreal Canadiens,Head To Head,Edmonton Oilers,1.37,Montreal Canadiens,3.11,1.051,Sportsbet
Colorado Avalanche v San Jose Sharks,Head To Head,Colorado Avalanche,1.23,San Jose Sharks,4.25,1.048,Sportsbet
