match,market_name,home_team,home_win,away_team,away_win,margin,agency
Tampa Bay Lightning v Philadelphia Flyers,Head To Head,Tampa Bay Lightning,1.36,Philadelphia Flyers,3.16,1.052,Sportsbet
Columbus Blue Jackets v New Jersey Devils,Head To Head,Columbus Blue Jackets,2.07,New Jersey Devils,1.76,1.051,Sportsbet
Boston Bruins v Buffalo Sabres,Head To Head,Boston Bruins,1.76,Buffalo Sabres,2.07,1.051,Sportsbet
Toronto Maple Leafs v Calgary Flames,Head To Head,Toronto Maple Leafs,1.45,Calgary Flames,2.76,1.052,Sportsbet
Minnesota Wild v Los Angeles Kings,Head To Head,Minnesota Wild,2.23,Los Angeles Kings,1.66,1.051,Sportsbet
